Former Trump adviser interviewed in Congress in Russia probe,"WASHINGTON (Reuters) - Walid Phares, a former campaign adviser to President Donald Trump, testified to the U.S. House of Representatives Intelligence Committee on Friday in its investigation of possible Russian efforts to influence the 2016 U.S. election. Phares did not speak to reporters as he entered the committee’s classified meeting room around 11 am EDT (1600 GMT) or when he left about four hours later. In response to a request for comment Phares’ assistant told Reuters: “Dr. Phares is not making any comments for now.” The House Intelligence panel does not discuss details of most of the dozens of interviews conducted behind closed doors during its months-long investigation, but it has been disclosed publicly that Phares has come under congressional scrutiny over his connections with Russia. Senator Dianne Feinstein, the top Democrat on the Senate Judiciary Committee, wrote last month to Phares, who was a Trump campaign foreign policy adviser, asking him to turn over “documents related to Russian contacts and the Republican Party’s position on Ukraine.” In her letter to Phares, Feinstein said she was interested in a meeting that he and two other Trump advisers allegedly held during the Republican National Convention in Cleveland in 2016 with Sergei Kislyak, then Russia’s ambassador to the United States. On Nov. 29, when Feinstein announced her request, a Phares aide said he maintains Kislyak was just one of many foreign diplomats present at a panel discussion, which could not “fairly” be described as a meeting with Russian officials. The Senate Judiciary and Senate Intelligence panels are also investigating Russia and last year’s election and possible collusion between Trump associates and Moscow, as is Department of Justice Special Counsel Robert Mueller. U.S. intelligence agencies concluded that Russia sought to influence the 2016 U.S. election to help Trump win the White House. Russia denies any such effort and Trump has dismissed talk of collusion. ",politicsNews,"December 8, 2017 "
Congressman Franks says resigning immediately,"WASHINGTON (Reuters) - U.S. Representative Trent Franks said on Friday that he would resign from Congress effective immediately, instead of the Jan. 31 date he previously had set following the announcement of a probe into accusations of sexual harassment against him. “Last night, my wife was admitted to the hospital in Washington, D.C., due to an ongoing ailment. After discussing options with my family, we came to the conclusion that the best thing for our family now would be for me to tender my previous resignation effective today, December 8th, 2017,” Franks said in an emailed statement. Late on Thursday, Franks, who has represented a district in the Phoenix, Arizona, area since 2003, issued a statement saying that two women on his staff complained that he had discussed with them his efforts to find a surrogate mother, but he denied he had ever “physically intimidated, coerced, or had, or attempted to have, any sexual contact with any member of my congressional staff.” The news website Politico on Friday quoted unnamed sources that it was not clear to the women whether he was asking about impregnating them through sexual intercourse or in vitro fertilization. The Associated Press reported that a former aide to Franks said the congressman offered her $5 million to carry his child. Reuters has not confirmed either report. The House of Representatives Ethics Committee said on Thursday it had opened an investigation into accusations of sexual harassment against Franks. The 60-year-old lawmaker also said that he and his wife “have long struggled with infertility.” Franks’ departure comes just days after Democratic Representative John Conyers of Michigan announced his immediate retirement amid sexual harassment allegations that he has denied. On Thursday, Democratic Senator Al Franken announced on the Senate floor that he too would resign his Minnesota seat amid harassment claims. ",politicsNews,"December 8, 2017 "
Special election to replace Conyers to be held Nov. 2018: governor,"WASHINGTON (Reuters) - Michigan Governor Rick Snyder said on Friday the state would hold a special election on Nov. 6, 2018, to replace Representative John Conyers, the Democrat who resigned this week amid accusations of sexual misconduct. “Having ample time for candidates to make a decision about running for office and file their paperwork gives people more options,” Snyder said in a statement.  ",politicsNews,"December 8, 2017 "
Trump signs temporary spending bill as budget talks intensify,"WASHINGTON (Reuters) - U.S. President Donald Trump on Friday signed legislation to fund the federal government for two weeks, giving congressional negotiators more time to work out budget priorities through next September and other thorny policy matters. White House spokeswoman Sarah Sanders said in a post on Twitter that Trump, as expected, signed the stop-gap funding bill that averts a shutdown of federal agencies at midnight when existing money runs out. For months, Republican and Democratic leaders in Congress have been working behind the scenes to hammer out a deal to fund government for fiscal 2018, which began on Oct. 1. Absent that deal, Washington has been operating on temporary spending bills. Much of the negotiation centers around Republican demands for increased military spending. Democrats say the Pentagon does need more money, but they argue that an array of other domestic programs also face shortfalls. A senior Senate Democratic aide said on Friday that the negotiators are trying to figure out how to divide up $200 billion over two years in additional funding. That much of a spending increase is setting off alarms among conservative Republicans. Representative Mark Meadows, who heads the House Freedom Caucus comprised of about three dozen of some of the most conservative members of Congress, said that $70 billion to $80 billion in added spending would be more reasonable. The caucus is pushing for Pentagon increases without more money for other domestic programs.  Besides the spending levels, the Democratic aide said negotiators are hoping to come to a deal on protecting around 700,000 undocumented immigrants, who were brought to the United States as children, from possible deportation. Other elements of the negotiations include new disaster relief funds for Puerto Rico and U.S. states hard-hit by hurricanes and wildfires, as well as funding for a children’s health-insurance program for low-income families and money for community health centers. Many in Congress hope the negotiations on these issues can be wrapped up before Dec. 22, when current funding expires and lawmakers hope to leave Washington for a winter break. ",politicsNews,"December 8, 2017 "
Franken and Franks resign as misconduct charges batter Congress,"WASHINGTON (Reuters) - U.S. Democratic Senator Al Franken announced his resignation on Thursday after facing a series of sexual misconduct allegations, and Republican Representative Trent Franks also said he was stepping down as he too was hit with ethics charges.  Franken, buffeted for weeks by sexual harassment charges and under pressure from party colleagues, said on the Senate floor he would leave in a few weeks, although he denied some of the allegations against him and questioned others. The 66-year-old former comedian from Minnesota had been seen as a rising star in the Democratic Party. “I know in my heart that nothing I’ve done as a senator - nothing - has brought dishonor on this institution,” he said. “Nevertheless, today I am announcing that in the coming weeks, I will be resigning as a member of the United States Senate.” Hours later, Franks announced his resignation after two former staff members complained about discussions he had with them about his efforts to find a surrogate mother. “I deeply regret that my discussion of this option and process in the workplace caused distress,” said Franks, who was first elected to his Arizona congressional seat in 2002 and is an outspoken opponent of abortion.  Franks said in a statement that he and his wife “have long struggled with infertility.” The developments came with Congress already held in low regard by voters. According to a Reuters/Ipsos poll, only 20 percent approved of the way Congress was handling its job, with 70 percent disapproving. In recent weeks, charges of sexual misconduct have taken down prominent people in the worlds of entertainment, media and politics. It is somewhat rare for members of the Senate or House of Representatives to resign from office, but veteran Democratic Representative John Conyers also resigned earlier this week amid sexual harassment accusations that he has denied. The House Ethics Committee said on Thursday it was investigating yet another lawmaker. Blake Farenthold, a Republican representative from Texas, faces allegations of sexual harassment, discrimination and retaliation involving a former female staff member. Franken has the highest profile of the lawmakers hit by allegations in the past few weeks.  Reuters has not independently verified the accusations against Franken, Franks, Conyers or Farenthold. Franken’s seat will initially be filled by a Democrat appointed by Minnesota’s Democratic governor, meaning the  Republicans’ slim majority in the Senate will not change. Allegations that Franken had groped and tried to kiss women without their consent began to surface three weeks ago. He initially said he was embarrassed and ashamed by his behavior but would not resign.  But the majority of his Democratic colleagues in the Senate called on Wednesday for his resignation after a new allegation, denied by Franken, hit the news.  “Some of the allegations against me are simply not true. Others I remember very differently,” Franken said on Thursday.  Striking a tone of defiance, he also sought to contrast himself with two prominent Republicans - President Donald Trump and Senate candidate Roy Moore. “I, of all people, am aware that there is some irony in the fact that I am leaving while a man who has bragged on tape about his history of sexual assault sits in the Oval Office and a man who has repeatedly preyed on young girls campaigns for the Senate, with the full support of his party,” he said. Trump was heard bragging about kissing and forcibly touching women in a 2005 videotape that surfaced last year as he was running for the White House. He apologized for the remarks, but called them private “locker-room talk” and said he had not done the things he talked about.  Trump also denied allegations at that time by at least 12 women of sexual advances and groping in the past. Moore, who is running for the Senate in Alabama in a special election on Tuesday, has been accused by several women of sexual assault or misconduct when they were teenagers and Moore was in his early 30s. Moore, 70, has denied the accusations, which Reuters has not independently verified. Trump has backed Moore, but Senate Republicans have been cooler toward his candidacy. In pressing Franken to step aside, Democrats have tried to capture the moral high ground and draw a distinction between their party and Republicans.         “In every workplace in America, including the U.S. Senate, we must confront the challenges of harassment and misconduct,” said Amy Klobuchar, Franken’s fellow Democratic senator from Minnesota.     Similarly, House Republican Speaker Paul Ryan said on Thursday he had told Franks that he should resign. A special election will be scheduled to determine a replacement for Franks. While a Democrat will be appointed initially to replace Franken, his departure could complicate the party’s efforts to maintain or build on the 46 Senate seats they hold. Two independent senators also vote with the Democrats. Republicans are defending eight seats in the congressional elections in November 2018 but Democrats will be defending 26 if Minnesota holds a special election for Franken’s seat. The election to fill Franken’s seat could be close. When he ran in 2008, the race was decided after an extensive recount, with Minnesota’s Supreme Court weighing in.  In the 2016 presidential election, Democrat Hillary Clinton won the state by less than 2 percentage points. ",politicsNews,"December 7, 2017 "
Rep. Franks to resign after staff members' complaints of harassment,"WASHINGTON (Reuters) - Republican U.S. Representative Trent Franks said on Thursday he would resign after two female staffers complained that he had discussed surrogacy with them. Franks, 60, who has been a member of Congress from Arizona since 2003, said in a statement that he would step down on Jan. 31. The House of Representatives Ethics Committee said on Thursday it had opened an investigation into accusations of sexual harassment against Franks. The congressman said he was resigning because coverage of the committee’s investigation in the “current cultural and media climate” would “damage those things I love most.” Franks said he and his wife had struggled with infertility and sought a surrogate in order to have another child after they had twins with a surrogate. “I have recently learned that the Ethics Committee is reviewing an inquiry regarding my discussion of surrogacy with two previous female subordinates, making each feel uncomfortable,” Franks said. “I deeply regret that my discussion of this option and process in the workplace caused distress,” he said. Franks denied he ever “physically intimidated, coerced, or had, or attempted to have, any sexual contact with any member of my congressional staff.” U.S. House Speaker Paul Ryan was briefed on the allegations on Nov. 29 and urged Franks to resign in a conversation the following day, Ryan’s office said in a statement. “The speaker takes seriously his obligation to ensure a safe workplace in the House,” the statement said. Franks, a member of the conservative House Freedom Caucus, represents Arizona’s 8th Congressional District, a mainly suburban area of Phoenix. He won re-election in 2016 with 68.5 percent of the vote. Republican President Donald Trump carried the district by 21 points last year.  Republican Arizona Governor Doug Ducey will call a special election to fill the seat. The nominating primary must be held between 80 and 90 days after the vacancy and the general election must be conducted 50 to 60 days after the primary, according to state law. Numerous prominent men in U.S. politics, media and entertainment have been accused in recent months of sexual harassment and misconduct.  Earlier on Thursday, Democratic Senator Al Franken of Minnesota said he would resign in a few weeks following allegations of sexual misconduct. U.S. Democratic Representative John Conyers of Michigan resigned on Tuesday after accusations of sexual harassment were leveled against him. Conyers denied the allegations, while Franken said some of the accusations against him were untrue and he remembered other incidents differently from his accusers. Reuters has not verified the allegations against either man. ",politicsNews,"December 7, 2017 "
Aide tries to refocus U.S. tax debate after Trump's corporate rate remark,"WASHINGTON (Reuters) - President Donald Trump’s weekend remark about a scaled-back tax cut for corporations sparked behind-the-scenes debate in the U.S. Congress, with a White House aide trying on Thursday to minimize the impact of the president’s comment. Two rival tax bills, passed separately by the Senate and the House of Representatives, propose cutting the U.S. corporate tax rate to 20 percent, but they differ in other areas that Republicans are trying to merge into final legislation. Speaking to reporters after the Senate approved its tax bill on Saturday, Trump said the corporate tax rate in the final legislation, expected soon from lawmakers, “could be 22 (percent) ... it could also be 20 (percent).” The remark whetted the interest of some Republicans who see a slight upward bump in the proposed corporate tax rate as  capturing needed federal revenue that would help solve other problems with the legislation, according to lobbyists.  “The 20 percent rate ought to be our goal,” said House Ways and Means Committee Chairman Kevin Brady, who is expected to head a bicameral House-Senate negotiating committee. “My view is the president is giving us flexibility in that area if it’s needed. No decision’s been made on if that’s needed,” the Texas Republican told reporters. But White House legislative affairs director Marc Short told Reuters on Thursday that Trump was not voicing support for a higher proposed corporate rate. Instead, he may have been only expressing views conveyed to him by Republican senators.  “I think he was just reflecting what conversations he had heard from them, but that ... wasn’t intended to signal: this is an endorsement of raising the corporate rate,” Short said. “We believe that 20 percent is the right number ... 20 percent is about as high as we feel comfortable going,” he said in an interview. Trump and his Republican allies have plenty riding on what happens over the next few weeks. A sweeping U.S. tax overhaul, which has not been achieved since 1986, would give Republicans their first major legislative victory of 2017, after their failure to overturn former President Barack Obama’s healthcare law. Without a win, Republicans fear they could lose their control of the House and Senate in the 2018 congressional elections. But it may be too late to avoid confusion over priorities as the tax debate moves forward in Congress. Lobbyists said many perceive that Trump and his advisers would accept a corporate rate higher than 20 percent. White House economic adviser Kevin Hassett said on Thursday that a 22 percent corporate rate would not undermine the economic boost that Republicans say tax cuts will create. Analysts say the corporate income tax rate could be a ready source of revenue for lawmakers, as they move toward a final bill that can lose no more than $1.5 trillion in revenue over the next decade under Senate rules. Republicans are considering a more costly deduction for state and local taxes than the $10,000 property tax deduction contained in the House and Senate bills. One version would allow taxpayers to choose a $10,000 deduction for either property or income taxes. House lawmakers also want to adopt the House bill’s repeal of the corporate alternative minimum tax, which would cost about $40 billion in revenue over a decade, according to the Joint Committee on Taxation. Senate retained the tax. A House limit on the amount of debt interest payments that businesses can deduct from their income would also cost about $136 billion more than the Senate version, the JCT said. Analysts say a one percentage point change in the corporate rate equals about $100 billion in revenues over a decade. ",politicsNews,"December 7, 2017 "
Civil rights pioneer to eschew museum opening after Trump says will attend,"(Reuters) - Longtime U.S. congressman from Georgia John Lewis, who marched with Martin Luther King Jr. in the 1960s, said on Thursday that he would not attend the opening of the Mississippi Civil Rights Museum this weekend because President Donald Trump planned to attend. “President Trump’s attendance and his hurtful policies are an insult to the people portrayed in this civil rights museum,” Lewis said in a statement. The statement by the Georgia Democrat, who has served in Congress for 31 years, and Mississippi Democratic U.S. Representative Bennie Thompson mentioned Trump’s “disparaging comments about women, the disabled, immigrants, and National Football League players.” Trump said earlier this week that he would attend the opening of the museum in Jackson, the state capital.  The National Association for the Advancement of Colored People (NAACP) has denounced Trump’s planned attendance.  Lewis and Thompson said in their statement that Trump had  shown “disrespect” for people who fought for civil rights in Mississippi. White House Press Secretary Sarah Sanders, responding to the Lewis-Thompson statement, said, “We think it’s unfortunate that these members of Congress wouldn’t join the president in honoring the incredible sacrifice civil rights leaders made to right the injustices in our history. The President hopes others will join him in recognizing that the movement was about removing barriers and unifying Americans of all backgrounds.” ",politicsNews,"December 8, 2017 "
House ethics panel probing Rep. Farenthold over harassment allegations,"WASHINGTON (Reuters) - The U.S. House of Representatives Ethics Committee said on Thursday it was investigating Republican Representative Blake Farenthold over allegations of sexual harassment, discrimination and retaliation involving a former female staff member. The panel said in a statement it was also looking into whether the Corpus Christi, Texas, congressman made inappropriate statements to other members of his official staff. Farenthold, 55, said in a statement he was relieved that the ethics panel was going to look into the allegations. “Once all the facts are released, I’m confident this matter will once and for all be settled and resolved,” he said. Politico reported last week that the U.S. Congress’ Office of Compliance had paid $84,000 from a public fund on behalf of Farenthold for a sexual harassment claim. In 2014, Farenthold’s former communications director Lauren Greene sued him, alleging a hostile work environment, gender discrimination and retaliation, court documents showed. Farenthold and Greene reached a mediated agreement in 2015 to avoid costly litigation, but the settlement’s details were confidential, according to a statement released at the time, where Farenthold denied engaging in any wrongdoing. Farenthold told KRIS-TV in Corpus Christi on Monday that he would return the sum. Capitol Hill has been rocked in recent weeks by allegations of sexual misconduct by lawmakers, and outrage that public money may have been paid to settle harassment suits against members of Congress. Three lawmakers said this week they would resign amid sexual harassment allegations: Democratic Senator Al Franken, Democratic Representative John Conyers and Republican Representative Trent Franks. ",politicsNews,"December 8, 2017 "
Factbox: Trump on Twitter (December 7) - Pearl Harbor Remembrance Day,"The following statements were posted to the verified Twitter accounts of U.S. President Donald Trump, @realDonaldTrump and @POTUS.  The opinions expressed are his own. Reuters has not edited the statements or confirmed their accuracy.  @realDonaldTrump : - Go get the new book on Andrew Jackson by Brian Kilmeade...Really good. @foxandfriends [0808 EST] - National Pearl Harbor Remembrance Day - “A day that will live in infamy!” December 7, 1941 [1004 EST] - Today, our entire nation pauses to REMEMBER PEARL HARBOR—and the brave warriors who on that day stood tall and fought for America.  God Bless our HEROES who wear the uniform, and God Bless the United States of America. #PearlHarborRemembranceDay [1116 EST] - Today, the U.S. flag flies at half-staff at the @WhiteHouse, in honor of National Pearl Harbor Remembrance Day. instagram.com/p/BcaeCLLAEkl/ [1504 EST] - Today, as we Remember Pearl Harbor, it was an incredible honor to be joined with surviving Veterans of the attack on 12/7/1941. They are HEROES, and they are living witnesses to American History. All American hearts are filled with gratitude for their service and their sacrifice. [1552 EST] - Across the battlefields, oceans, and harrowing skies of Europe and the Pacific throughout the war, one great battle cry could be heard by America’s friends and foes alike: -- Source link: (bit.ly/2jBh4LU) (bit.ly/2jpEXYR) ",politicsNews,"December 7, 2017 "
House approves stop-gap government funding bill,"WASHINGTON (Reuters) - The U.S. House of Representatives, working against a Friday midnight deadline, approved legislation on Thursday to fund a wide range of federal programs through Dec. 22 and avoid a partial government shutdown when existing money expires. By a vote of 235-193, the House approved the stop-gap spending bill, sending it to the Senate for passage, which is expected by Friday. ",politicsNews,"December 7, 2017 "
President's son had legitimate reasons to not answer House panel questions: White House,"WASHINGTON (Reuters) - The White House said on Thursday that Donald Trump Jr. was on solid legal ground when he refused to answer questions from a congressional committee about a conversation he had with his father, President Donald Trump, about emails relating to a meeting he attended with Trump associates and Russians. Spokeswoman Sarah Sanders said the White House believed there was a “legitimate reason and basis for not answering those questions.” She declined to provide details. ",politicsNews,"December 7, 2017 "
