Massachusetts Senate president steps aside as husband faces probe,"BOSTON (Reuters) - Massachusetts Senate President Stan Rosenberg is taking a temporary leave of absence as his husband faces allegations that he used his political connections to sexually harass men. Rosenberg, a Democrat, will step aside immediately and will remain away during an investigation by the Senate, he said in a statement on Monday.  “I want to ensure that the investigation is fully independent and credible, and that anyone who wishes to come forward will feel confident that there will be no retaliation,” Rosenberg wrote. Last week, Rosenberg, 68, said he supported the investigation and that his husband, Bryon Hefner, 30, was planning to enter an inpatient treatment center for alcohol dependency. The Boston Globe reported that four unnamed men said Hefner, had groped them or made other unwanted sexual contact. The newspaper said the men asked to remain anonymous for fear that speaking out against the powerful lawmaker’s spouse would endanger their work as political advocates. Reuters could not confirm the allegations, which the newspaper said stemmed from incidents in 2015 and 2016. The accusations are the latest in a wave of sexual assault and sexual harassment claims levied against powerful men in U.S. politics, entertainment and journalism. ",politicsNews,"December 4, 2017 "
McConnell optimistic of tax bill deal between Senate and House,"WASHINGTON (Reuters) - U.S. Senate Republican leader Mitch McConnell said on Sunday that he is optimistic the Senate and House of Representatives will reach a conference agreement on tax legislation that can be signed into law by President Donald Trump. “We’ll be able to get to an agreement in the conference. I’m very optimistic about it,” the Kentucky Republican told ABC’s “This Week” program.   ",politicsNews,"December 3, 2017 "
Factbox - Republicans cut side deals to push through U.S. Senate tax bill,"WASHINGTON (Reuters) - U.S. Senate Republicans made last-minute changes to their tax bill to secure enough votes to pass the sweeping legislation on Saturday and move on to negotiations this week on a final measure with Republicans in the House of Representatives. The deals enabled leadership to get four wavering Republican senators on board with the legislation by addressing issues such as deductions for state and local property taxes and the tax treatment of so-called pass-through enterprises.  Republicans also agreed to changes to help pay for the deals, including higher tax rates on the repatriation of U.S. corporate profits held overseas.   Following are some of the changes:  STATE AND LOCAL PROPERTY TAXES: Senator Susan Collins got Senate Republican leaders to include a federal deduction for up to $10,000 in state and local property taxes in the legislation, which eliminates a similar deduction for state and local income and sales taxes. The nonpartisan Joint Committee on Taxation, or JCT,  estimates that the change will mean the loss of an additional $148 billion in federal revenue over the next decade, compared with a legislative proposal approved earlier by the Senate Budget Committee.   PASS-THROUGHS: Under pressure from Senators Ron Johnson and Steve Daines, Senate Republican leaders increased to 23 percent from 17.4 percent a deduction for the owners of pass-through enterprises including small businesses, S-corporations, partnerships and sole proprietorships. JCT estimated revenue loss versus earlier legislative proposal: $114 billion.     FULL EXPENSING: Senator Jeff Flake, who had been a holdout over deficit concerns, agreed to vote “yes” after Republican leaders did away with an abrupt end to the full business expensing of capital investments after five years. Instead, the bill phases out full expensing in 20 percent increments over four years, beginning in year six. Flake said Congress would not have been able to suddenly eliminate full expensing and that benefit would have been left to bleed red ink for years to come.  JCT revenue loss estimate versus earlier legislative proposal: $34 billion.   MEDICAL EXPENSES: Collins also added language to reduce the threshold for deducting unreimbursed medical expenses for two years to 7.5 percent of household income from 10 percent.  JCT estimated revenue loss versus earlier legislative proposal: $4.6 billion.  RETIREMENT SAVINGS: Collins persuaded Republican leaders to retain catch-up contributions to retirement accounts for church, charity, school and public employees. No immediate JCT revenue impact estimate.   INDIVIDUAL ALTERNATIVE MINIMUM TAX: Republicans rescinded an earlier provision to repeal the individual AMT but increased exemption amounts and phase-out thresholds to make the tax less onerous. JCT estimated revenue gain versus earlier legislative proposal: $133 billion over a decade.   REPATRIATION: Senate Republicans increased tax rates on the repatriation of U.S. corporate profits held overseas to 14.5 percent for liquid assets and 7.5 percent for illiquid holdings, up from 10 percent and 5 percent, respectively. JCT estimated revenue gain versus earlier legislative proposal: $113 billion.  CORPORATE ALTERNATIVE MINIMUM TAX: Republicans decided to retain this tax, after initially proposing its repeal. JCT estimated revenue gain versus earlier legislative proposal: $40.3 billion. ",politicsNews,"December 3, 2017 "
U.S. embassy to Russia to resume some visa services after diplomatic row,"MOSCOW (Reuters) - The U.S. Embassy to Russia said on Monday it would restart some visa services in U.S. consulates which it had previously canceled due to diplomatic expulsions that had left it short-staffed. The United States began to scale back its visa services in Russia in August, drawing an angry reaction from Moscow three weeks after President Vladimir Putin ordered Washington to more than halve its embassy and consular staff. The U.S. step meant Russian citizens wanting to visit the United States for business, tourism or educational reasons were  no longer able to apply via U.S. consulates outside Moscow and had to travel to the Russian capital instead. The embassy said in a statement on Monday some visa services would resume on Dec. 11. “On December 11, the U.S. consulates in St. Petersburg, Yekaterinburg, and Vladivostok will begin to offer limited interviews for non-immigrant visas,” it said. ",politicsNews,"December 4, 2017 "
Kremlin says Putin not influenced by ex-Trump official Flynn,"MOSCOW (Reuters) - The Kremlin said on Monday Russian President Vladimir Putin had taken a decision to hold off responding to new U.S. sanctions last year independently and had not been influenced by former U.S. national security adviser Michael Flynn. Flynn pleaded guilty on Friday to lying to the FBI about his contacts with Russia and agreed to cooperate with prosecutors delving into the actions of President Donald Trump’s inner circle before he took office. U.S. prosecutors said Flynn and Sergei Kislyak, then Russian ambassador to the U.S., last December discussed economic sanctions that the Obama administration had just imposed on Moscow for allegedly interfering in the U.S. presidential election, something Moscow denies. Obama at the time expelled 35 Russian diplomats and the U.S. authorities seized two Russian diplomatic compounds in the United States.  But Putin said he would wait to see how relations developed with the new Trump administration before responding. Russia only went ahead and took retaliatory measures this summer. Kremlin spokesman Dmitry Peskov said Putin had taken the decision to hold off retaliating independently and had not known of Flynn’s alleged request to Russia to refrain from an immediate response. Flynn was not in a position to ask Kislyak, the then Russian Ambassador to the U.S., to do anything, said Peskov, calling the idea “absurd.”  “Of course Putin took the decision, it was his decision,” Peskov told a conference call with reporters.  “It (the decision) could not have been connected to any requests or recommendations. The president takes his decisions absolutely independently.”  ",politicsNews,"December 4, 2017 "
"Billy Bush: It was Trump's voice on ""Access Hollywood"" tape","WASHINGTON (Reuters) - Former NBC television host Billy Bush accused U.S. President Donald Trump of “indulging in some revisionist history” for reportedly telling allies it was not his voice making lewd remarks as the men waited to film a segment for “Access Hollywood” in 2005. “He said it. ‘Grab ‘em by the pussy,’” Bush wrote in an editorial published in the New York Times on Sunday.  The New York Times reported last month that Trump has been privately telling aides and allies, including at least one U.S. senator, that the voice on the recording was not his.  That would be a reversal from his immediate acknowledgement of responsibility after the tape surfaced weeks ahead of the 2016 presidential election. Trump said: “I said it, I was wrong, and I apologize.” Reuters has not been able to verify the Times report that he has been privately telling allies a different story. The White House did not immediately respond to a request for comment on  Bush’s remarks. But White House spokeswoman Sarah Sanders played down the Times report at a White House briefing on Nov. 27. “The President hasn’t changed his position. I think if anything that the president questions, it’s the media’s reporting on that accuracy,” Sanders said. Bush laughed on the video as Trump spoke and he lost his job as a host of NBC’s flagship morning “Today” show after the tape was leaked to the media in October, upending Trump’s campaign to become president.  ",politicsNews,"December 4, 2017 "
Embattled Alabama Republican Senate candidate ahead in CBS poll,"WASHINGTON (Reuters) - Embattled Republican U.S. Senate candidate Roy Moore led his Democratic opponent by six percentage points in a CBS News poll released on Sunday, with most Alabama Republicans saying the allegations of sexual misconduct against him are false. Moore was leading Democrat Doug Jones 49 to 43 percent among voters likely to cast ballots in the Dec. 12 special election, CBS said. The contest was even among registered voters, it said. Republican lawmakers in Washington, including Senate Republican leader Mitch McConnell, have distanced themselves from Moore and called for him to step down from the race after he was accused by several women of sexual assault and misconduct when they were teenagers and he was in his early 30s. Reuters has not been able to independently verify the allegations. But McConnell said on Sunday that if Moore is elected, the Senate will swear him in and then the Senate ethics committee would decide whether to investigate the allegations. “We’ll swear in whoever’s elected and see where we are at that point,” McConnell said on CBS’ “Face the Nation.” “We can’t stop him from being seated,” said Republican Senator Lindsey Graham, who was also interviewed on CBS. “If there was an (ethics) investigation and all six members of the committee said they believe he was a child molester, that would be a problem.” According to the CBS poll, 71 percent of Alabama Republicans say the allegations against Moore are false, and believe that Democrats and the media are behind the accusations. Another poll a day earlier had Jones barely ahead. The Washington Post-Schar School poll said Jones’ support among likely voters stood at 50 percent, versus Moore’s 47 percent. President Donald Trump originally backed Moore’s opponent in the Republican primary, Senator Luther Strange. But Trump has since defended Moore, noting Moore has denied allegations of sexual misconduct. The president says he does not want Moore’s Democratic opponent to win. Trump is slated to travel to a rally in Pensacola, Florida on Friday — a city just across the state line from Alabama — just days ahead of the Alabama election. The timing and location gives Trump an opportunity to express support for Moore. Republicans hold a slim 52-48 majority in the Senate and are eager to maintain their advantage to advance Trump’s legislative agenda on taxes, healthcare and other priorities. ",politicsNews,"December 3, 2017 "
U.S. allies fret as 'guillotine' hangs over Tillerson,"BRUSSELS/BERLIN (Reuters) - On the eve of his trip to Europe, Rex Tillerson gave a speech last week that European allies had waited months to hear: an “ironclad” promise of U.S. support to its oldest allies. The relief in European capitals lasted barely a day as reports surfaced of a White House plan to oust the U.S. secretary of state, plunging America’s friends back into confusion over President Donald Trump’s foreign policy. The uncertainty is particularly acute given Washington’s leading role in crises in North Korea and Syria. “Just as Tillerson comes to Brussels to give a public statement of support that the EU and NATO have wanted all along, it seems he has no mandate, that the guillotine is hanging over his head,” said an EU official involved in diplomacy with White House officials. “It leaves Europe just as doubtful as before about Trump.” U.S. officials said on Thursday the White House had a plan for CIA Director Mike Pompeo to replace Tillerson but Trump said on Friday he was not leaving and the secretary of state said on Saturday the reports were untrue. European leaders yearn for stability in U.S. foreign policy. They are troubled by Trump’s “America first” rhetoric and inconsistent statements on NATO and the European Union. In addition, Trump’s decision to pull out of the Paris climate change accord and his decision not to certify Iran’s compliance with a nuclear deal undermine European priorities. “The chaos in the administration doesn’t help in the current geopolitical climate,” said a senior French diplomat. Early last week, Tillerson, a former Exxon Mobil chief executive, delivered a long address in support of Europe in Washington more akin to traditional U.S. policy. “The United States remains committed to our enduring relationship with Europe. Our security commitments to European allies are ironclad,” he told a think tank.  He said he would convey that message to the European Union and NATO. He is set to visit Brussels on Tuesday and Wednesday, the Organization for Security and Cooperation in Europe in Vienna on Thursday and Paris on Friday. The question is whether European officials believe him, given tensions during his April visit to Europe, when Reuters reported Tillerson initially planned to skip a NATO meeting in Brussels and then only attended under pressure from allies. “If there were expectations that Tillerson might evolve into a counterweight to Trump, someone who could pass on messages from partners and exert moderating influence over American foreign policy – those expectations have been disappointed,” said Niels Annen, foreign policy spokesman for Germany’s Social Democrats in parliament. “On his watch, the State Department has become a non-actor.” Despite Tillerson’s pledge to reform the U.S. foreign service, European governments take a dim view of how he has sought to cut costs at the State Department, with top diplomatic posts unfilled almost a year into the administration.  The French have gone around Tillerson to develop contacts with U.S. Secretary of Defense Jim Mattis, White House National Security Adviser H.R. McMaster and White House Chief of Staff John Kelly, while the EU’s top diplomat Federica Mogherini has gone directly to Vice President Mike Pence. Berlin has focused on Capitol Hill, as well as Kelly, McMaster and Mattis. Yet it is unclear if that access translates into a direct impact on Trump’s foreign policy, diplomats said. There is hope that if Pompeo is appointed he could rejuvenate the State Department after Tillerson, who is seen as ineffective, diplomats said. Pompeo is an unknown quantity in Europe but is viewed as closer to Trump. “We may be looking at a larger dose of Trump at the State Department,” if Pompeo did get the job, said Thomas Kleine-Brockhoff, head of the German Marshall Fund’s Berlin office. One European diplomat said Tillerson was in a difficult position from the outset because the Trump administration was hostile to Iran and brought in a team of generals who took a hard line, “so it never left Tillerson much room.” In addition, Trump’s son-in-law Jared Kushner has taken a leading role in formulating policy on Middle East peace. But Europeans see Trump as a blizzard of conflicting signals. At a NATO summit in Brussels in May, the president publicly admonished European leaders for their low defense spending and threatened to reduce support, only to announce a jump in U.S. military spending in Europe months later. Things may only become more unpredictable, diplomats say. European diplomats see Tillerson and Mattis as instrumental in talking Trump out of making any rash decisions over North Korea and its nuclear program, given administration comments about “utterly destroying” the country. ",politicsNews,"December 3, 2017 "
McConnell says U.S. government shutdown over DACA 'ridiculous',"WASHINGTON (Reuters) - U.S. Senate Republican leader Mitch McConnell said on Sunday it would be “ridiculous” for a fight with Democrats over immigration issues to result in a standoff over a year-end spending bill and prompt a shutdown of the federal government. “There’s not going to be a government shutdown,” McConnell told ABC’s “This Week” program. “It’s just not going to happen.” As tensions rise between the two parties over the spending bill, McConnell called the Democrats’ position “untenable,” saying Congress has until March to address the status of so-called Dreamers, young immigrants brought to the United States illegally as children. With funding for the federal government due to run out on Friday, Republican leaders need to put together the votes for a spending bill. But Democrats have said they will insist on protections for Dreamers as the price of their support for a spending bill, setting the stage for a potential showdown. “That’s a ridiculous position,” McConnell told ABC. Although Republicans control both chambers of the U.S. Congress, at least some Democratic votes will be needed to pass the spending bill. In September, Trump ended the Deferred Action for Childhood Arrivals, or DACA, program, which shields young illegal immigrants from deportation. He gave Congress six months to find a solution. “I don’t think that Democrats would be very smart to say they want to shut down the government over a non-emergency that we can address anytime between now and March,” McConnell said. “That’s a very untenable position.” Trump and Republican leaders want measures strengthening border enforcement to accompany any relief for the Dreamers, a stance Democrats reject. McConnell said he was also optimistic that House and Senate Republicans could agree on unified tax legislation to send to President Donald Trump after the Senate approved its own bill on Saturday. ",politicsNews,"December 3, 2017 "
White House open to small changes on corporate tax rate: budget chief Mulvaney,"WASHINGTON (Reuters) - The White House is willing to consider a small increase on the corporate tax rate if it is needed to finalize the bill in the U.S. Congress, White House budget chief Mick Mulvaney said on Sunday. Mulvaney made his comments after President Donald Trump suggested on Saturday that the corporate tax rate could end up at 22 percent once the Senate and House of Representatives reconcile or “conference” their respective versions of the legislation, even though both bills currently stand at 20 percent. “My understanding is that the Senate (bill) has a 20 percent rate now. The House has a 20 percent rate now. We’re happy with both of those numbers,” Mulvaney said in an interview with CBS’ “Face the Nation.” “If something small happens in conference that gets us across the finish line, we’ll look at it on a case-by-case basis. But I don’t think you’ll see any significant change in our position on the corporate taxes,” Mulvaney said. ",politicsNews,"December 3, 2017 "
ABC News suspends top journalist over inaccurate Flynn reporting,"WASHINGTON (Reuters) - ABC News said on Saturday it had suspended Brian Ross, its chief investigative correspondent, over an error in his reporting about former national security adviser Michael Flynn which sent U.S. stocks, the dollar and Treasury yields lower on Friday. “We deeply regret and apologize for the serious error we made yesterday ... As a result of our continued reporting over the next several hours ultimately we determined the information was wrong and we corrected the mistake on air and online,” ABC News said in a statement. “Effective immediately, Brian Ross will be suspended for four weeks without pay,” added ABC News, owned by the Walt Disney Co.  Flynn pleaded guilty on Friday to lying to the FBI about his contacts with Russia, and he agreed to cooperate with prosecutors delving into the actions of President Donald Trump’s inner circle before he took office. Soon after, ABC News reported that Flynn, citing a confidant, was prepared to testify that Trump directed him to make contact with Russians when he was a presidential candidate. Wall Street’s main indexes all fell by more than 1 percent after the report.  ABC News later issued a correction that the source clarified that Trump had assigned Flynn and a “small circle of senior advisers” to find ways to improve relations with Russia and other hotspots during the presidential campaign.  “It was shortly after the election, that President-elect Trump directed Flynn to contact Russian officials on topics that included working jointly against ISIS,” ABC News said.   ",politicsNews,"December 2, 2017 "
