Trump administration bans selected words at health agencies: paper,"WASHINGTON (Reuters) - The Trump administration has told agencies within the Department of Health and Human Services to avoid using certain words or phrases in official documents being drafted for next year’s budget, the Washington Post reported on Saturday. The newspaper said one of the agencies, the U.S. Centers for Disease Control and Prevention, was given a list of seven prohibited words or phrases: “vulnerable,” “entitlement,” “diversity,” “transgender,” “fetus,” “evidence-based” and “science-based.” Officials at a second agency were also told to use “Obamacare” instead of the Affordable Care Act to describe President Barack Obama’s 2010 healthcare law and to use “exchanges” instead of “marketplaces” in reference to venues where people can buy federally subsidized health insurance, the Post reported. The HHS pushed back on the report.  “The assertion that HHS has ‘banned words’ is a complete mischaracterization of discussions regarding the budget formulation process,” spokesman Matt Lloyd said in a statement.  “HHS will continue to use the best scientific evidence available to improve the health of all Americans. HHS also strongly encourages the use of outcome and evidence data in program evaluations and budget decisions,” he said. The newspaper said State Department documents also now refer to sex education as “sexual risk avoidance.” A briefing at the second HHS agency relied on a document from the White House Office of Management and Budget, which oversees President Donald Trump’s annual budget proposal to Congress, according to the Post.   The Post said no explanations were given for the language changes.     ",politicsNews,"December 17, 2017 "
Trump to say in security speech that China is competitor: officials,"WASHINGTON (Reuters) - President Donald Trump will lay out a new U.S. national security strategy on Monday based on his “America First” policy and will, among other items, make clear that China is a competitor, two senior U.S. officials said on Saturday. Trump has praised Chinese President Xi Jinping while also demanding that Beijing increase pressure on North Korea over its nuclear program and to change trade practices to make them more favorable to the United States. The  national security strategy, to be rolled out in a speech by Trump, should not be seen as an attempt to contain China but rather to offer a clear-eyed look at the challenges China poses, said the officials, who spoke on condition of anonymity. The strategy, which was still being drafted, may also reverse Democratic President Barack Obama’s declaration in September 2016 that climate change is a threat to security, one official said. Trump, a Republican, is to lay out his foreign policy priorities, and will emphasize his commitment to “America First” policies such as building up the U.S. military, confronting Islamist militants and realigning trade relationships to make the United States more competitive, the officials said. ",politicsNews,"December 18, 2017 "
Republican tax bill retains U.S. electric vehicle tax credit,"WASHINGTON (Reuters) - A compromise Republican tax bill released late Friday does not eliminate a $7,500 electric vehicle tax credit as Republicans in the U.S. House of Representatives had previously proposed. The measure follows the lead of the Senate version approved last month that did not eliminate the credit. Killing the credit could have hurt automakers like General Motors Co (GM.N), Volkswagen AG (VOWG_p.DE), Tesla Inc (TSLA.O) and Nissan Motor Co (7201.T). Consumers under current law are eligible for a $7,500 tax credit to defray the cost of plug-in electric vehicles. The electric vehicle tax credit starts to phase out after a manufacturer sells 200,000 plug-in vehicles. After an automaker hits that point, the $7,500 tax credit is still available for at least three more months before phasing out.  Consumers are currently allowed to take the credit on vehicles until the manufacturer hits 200,000 plug-in vehicles sold. Electric vehicles have expensive batteries that make them pricier than gasoline-powered vehicles. The Electric Drive Transportation Association said in a statement late Friday it was pleased the credit would remain in law. “The credit supports innovation and job creation while helping drivers access advanced vehicle technology,” the group said. More than 50 automakers and other companies and groups released a letter earlier this week urging Congress to retain the credit, including Ford Motor Co (F.N), BMW AG (BMWG.DE), GM, Uber Technologies Inc. Former President Barack Obama repeatedly proposed hiking the tax credit for electric vehicles to $10,000 and converting it to a point-of-sale rebate, but Congress did not approve the measure. Automakers face mandates from California and a dozen other states to produce a rising number of zero-emission vehicles and have said the credits are essential to meeting requirements. ",politicsNews,"December 16, 2017 "
Attorney General Sessions has lukewarm praise for FBI after Trump attack,"WASHINGTON (Reuters) - U.S. Attorney General Jeff Sessions, who oversees the Federal Bureau of Investigation, on Friday offered a tepid endorsement of the nation’s leading law enforcement agency, which has been under attack by President Donald Trump and other Republicans. Trump said earlier this month that the FBI’s reputation was in “tatters” after news came to light that an FBI agent on a team investigating links between Russia and Trump’s election campaign had exchanged anti-Trump text messages with an FBI lawyer.     Sessions on Friday defended the bureau, which is part of the Department of Justice that he leads, but it was not an enthusiastic endorsement. “I don’t share the view that the FBI is not functioning at a high level all over the country,” he told a news conference. Sessions’ comments came at a time when former FBI director Robert Mueller is leading an investigation into Russian interference in the 2016 presidential election. A sampling of texts between agent Peter Strzok and FBI lawyer Lisa Page was released to Congress and the media earlier this week. The two referred to Trump as an “idiot,” but also took aim at other politicians, including Democrat Hillary Clinton, who lost to Trump in the 2016 election, and independent Bernie Sanders, who had sought the Democratic nomination for president. Strzok was transferred off Mueller’s team, but the texts provided fresh fodder for some Republicans who have fiercely criticized Mueller in a move that Democrats say is an effort to discredit his Russia investigation. Russia has denied meddling in the 2016 election, and Trump has repeatedly said his campaign did not collude with Russia.         Sessions is the latest senior official to defend the FBI. His comments were much milder than those of FBI Director Christopher Wray and Deputy Attorney General Rod Rosenstein in recent testimony to Congress. Sessions said Trump does support the FBI and noted that Trump spoke earlier on Friday to a class of domestic and international law enforcement managers graduating from an FBI training program in Quantico, Virginia. However, the audience did not consist of FBI agents, and Trump’s speech was to local and state police officers. Sessions also ducked a question about whether he will appoint a second special counsel to investigate some of the bias allegations against Mueller’s team, as some Republicans have demanded. ",politicsNews,"December 15, 2017 "
Senate Democrats to force vote on FCC net neutrality repeal,"WASHINGTON (Reuters) - The top U.S. Senate Democrat said on Friday he would force a vote on the Federal Communications Commission’s decision to repeal landmark net neutrality rules, but the move was unlikely to block a ruling that could reshape the digital landscape. The FCC voted Thursday along party lines to reverse the Obama era rules barring internet service providers from blocking or throttling internet traffic, or offering paid fast lanes. A group of state attorneys general vowed to sue. On Friday, Senator Charles Schumer of New York said he would force a vote on the FCC action under the Congressional Review Act. Republicans scuttled internet privacy rules adopted under the Obama administration using the same procedural vehicle. “There will be a vote to repeal the rule that the FCC passed. It’s in our power to do that,” Schumer said in New York. “Sometimes we don’t like them, when they used it to repeal some of the pro environmental regulations, but now we can use the CRA to our benefit and we intend to.” Senate Majority Leader Mitch McConnell opposes Schumer’s effort and backed the FCC repeal, a spokesman for the Republican said Friday. A reversal of Thursday’s FCC vote would need the approval of the Senate, U.S. House and President Donald Trump. Trump also backed the FCC action, the White House said Thursday. This week’s FCC order grants internet providers sweeping new powers to block, throttle or discriminate among internet content, but requires public disclosure of those practices. Internet providers have vowed not to change how consumers get online content. The FCC rules also seek to bar states from imposing their own net neutrality requirements. The FCC said the rules would take effect once the White House Office of Management and Budget approved the new transparency rules, which could take several months. Democrats say net neutrality is essential to protect consumers, while Republicans say the rules hindered investment by providers and were not needed. Moody’s Investors Service said in a note Friday the FCC vote was “credit positive” for internet service providers that could have faced rate regulation under the 2015 rules that would have treated them like public utilities. Moody’s said providers “will tread lightly when it comes to engaging in paid prioritization and throttling, as there could be significant negative public reaction to these acts.” Moody’s said “at least in the near term, the cost of negative publicity on their existing businesses far outweighs the benefit of additional revenue streams these companies can generate from paid prioritization agreements.” ",politicsNews,"December 15, 2017 "
Republican Senator Corker says he will support tax bill,"WASHINGTON (Reuters) - U.S. Republican Senator Bob Corker, a staunch fiscal hawk who has been a critic of emerging tax legislation, said on Friday he will support the sweeping tax overhaul that Republicans hope to approve next week. “I have decided to support the tax reform package we will vote on next week,” Corker, who had expressed concerned about the bill’s impact on the federal deficit, said in a statement released on Twitter. The details of the legislation are expected to be released later on Friday, with votes expected in the Senate and House of Representatives next Tuesday.  ",politicsNews,"December 15, 2017 "
"Republican Senator Rubio will back tax bill: CNBC, citing sources","WASHINGTON (Reuters) - U.S. Republican Senator Marco Rubio will support a compromise tax bill when it comes up for a vote next week in Congress, CNBC reported on Friday, citing unnamed sources. The Florida lawmaker earlier on Friday repeated his concerns that an expansion of child tax credits in the bill was too little to win his support, keeping a cloud over prospects for the legislation’s passage. ",politicsNews,"December 15, 2017 "
House committee questions head of Trump campaign data firm: sources,"WASHINGTON (Reuters) - Members of the U.S. House Intelligence Committee on Thursday interviewed the head of a data analysis firm to determine whether Donald Trump’s election campaign team sought his help to find thousands of emails missing from Hillary Clinton’s private server, three sources familiar with the session said. Trump’s campaign hired Alexander Nix and the company, Cambridge Analytica, in June 2016 and paid it more than $6.2 million through last December, according to Federal Election Commission records. The month after his firm was hired, Nix emailed WikiLeaks founder Julian Assange for help tracking down some 33,000 emails that Clinton supposedly had deleted from her private server, the Daily Beast and The Wall Street Journal reported in October. Nix wanted to convert the missing and potentially damaging emails into a searchable database for use by the Trump campaign or a pro-Trump political action committee, the Journal reported.  WikiLeaks confirmed to Reuters on Thursday that it was approached by Nix, but a representative said it turned down his request.     The intelligence committee is investigating possible collusion between Trump’s campaign team and Russia during the 2016 election. The matter is also being investigated by Special Counsel Robert Mueller and three other congressional committees. Russia has denied meddling in the election, and Trump has said there was no collusion between Moscow and his campaign.   Representatives Elijah Cummings and Jerrold Nadler, the top Democrats on the House Oversight and Judiciary committees, on Thursday asked their Republican committee chairmen to issue subpoenas for documents from Cambridge Analytica and Giles-Parscale, another data analysis firm that worked for the Trump campaign. Spokesmen for Cambridge Analytica and Giles-Parscale did not immediately respond to emails requesting comment.          Cummings and Nadler said they sent their letter after the two companies declined to answer questions about whether they had contacts with foreign actors during the 2016 presidential campaign. The sources said the intelligence committee members met at a Washington law office on Thursday to conduct the interview with Nix by Skype because he was not in the United States. The sources said the interview lasted some 90 minutes. The CIA, Federal Bureau of Investigation and the National Security Agency said in January that Russia used propaganda, social media and other means to meddle in the 2016 election to try to help Trump defeat Clinton.         In their report, the agencies said Russian intelligence services hacked emails and other documents from the Democratic National Committee and other Democratic Party organizations, and used Wikileaks to release them.  ",politicsNews,"December 15, 2017 "
Factbox: Provisions of the U.S. Republicans' final tax bill,"(Reuters) - Republicans in the U.S. Congress reached a deal on tax legislation on Wednesday, clearing the way for final votes next week on a package that, if approved, would be sent to President Donald Trump to sign into law. Formal language of the legislation, expected to add at least $1 trillion to the $20-trillion national debt over a decade, has not been released. The following are known provisions on which House of Representatives and Senate tax writers have agreed, based on conversations with aides and lawmakers: CORPORATE TAX RATE: Falls to 21 percent from 35 percent. The House and Senate bills, as well as Trump, had earlier proposed 20 percent. Going to 21 percent gave tax writers more federal revenue needed to allow the tax cut to take effect immediately. U.S. corporations have been seeking a large tax cut like this for many years.  PASS-THROUGH BUSINESSES: Creates a 20 percent business income deduction for owners of pass-through businesses, such as sole proprietorships and partnerships. The House had proposed a 25 percent tax rate; the Senate, a 23 percent deduction.  CORPORATE MINIMUM: Repeals the corporate alternative minimum tax, which was set up to ensure profitable companies pay at least some federal tax. CLEAN ENERGY: Maintains production tax credit for wind energy and the $7,500 electric vehicle tax credit. The House had proposed repealing the electric vehicle credit and scaling back the wind energy credit. The Senate version did neither. INDIVIDUAL INCOME TAX RATES: There will be seven brackets, and the top rate falls to 37 percent from 39.6 percent. The House had proposed maintaining the 39.6 percent top rate and condensing the current seven tax brackets to four. The Senate had proposed cutting the top rate to 38.5 percent and maintaining seven brackets. PERMANENCE: The expectation is that individual tax rates will snap back to current levels in less than 10 years, possibly after 2024. The individual tax rates in the House bill were to be permanent. The individual tax rates in the Senate bill were to expire after 2025. STATE AND LOCAL TAX (SALT): Both the House and Senate had proposed scaling back the popular individual deduction for state and local tax payments by limiting it to property-tax payments and capping that at $10,000. The compromise bill will keep that $10,000 cap, but allow for continued deduction of both state and local income tax payments, as well as property tax payments. MORTGAGE INTEREST: Caps the mortgage interest deduction for new mortgages at $750,000 in home loan value, down from the current $1 million. The House had proposed a $500,000 cap. The Senate bill left it at $1 million. ESTATE TAX: Roughly doubles the exemption from the federal estate tax on inherited assets to about $11 million per person, or about $22 million per couple, but leaves the estate tax in place, mirroring the Senate proposal. The House bill had proposed entirely repealing the estate tax over several years. OBAMACARE MANDATE: Repeals a federal fine imposed on Americans under Obamacare for not obtaining health insurance coverage. The House bill did not repeal the Obamacare individual mandate.  ANWR DRILLING: Allows oil drilling in Alaska’s Arctic National Wildlife Refuge. The provision was sponsored by Republican Senator Lisa Murkowski of Alaska. ",politicsNews,"December 14, 2017 "
House Speaker Ryan mulls retirement after 2018 elections: Politico,"WASHINGTON (Reuters) - Republican House Speaker Paul Ryan has told confidants he would like to retire after the 2018 congressional elections, Politico reported on Thursday, but the Wisconsin lawmaker and an aide played down the report, saying he wasn’t quitting any time soon. “Ryan has made it known to some of his closest confidants that this will be his final term as speaker,” Politico said.  Politico said it interviewed three dozen people who knew Ryan - including lawmakers, congressional and administration aides, conservative intellectuals and Republican lobbyists - and that “not a single person believed Ryan will stay in Congress past 2018.” White House spokeswoman Sarah Sanders said President Donald Trump had spoken to Ryan “and made sure that the speaker knew very clearly and in no uncertain terms that if that news was true, he was very unhappy with it.” “The speaker assured the president that those were not accurate reports and that they looked forward to working together for a long time to come,” Sanders said. Ryan is a long-time champion of tax reform who has helped bring Republicans in Congress to the cusp of a tax overhaul for the first time in a generation. If passed, it would be Trump’s first major legislative victory since he took office in January despite being helped by Republican control of Congress. When asked by reporters on Thursday if he was planning to quit, Ryan said with a chuckle: “I’m not, no.” Asked later about the Politico report, Ryan spokeswoman AshLee Strong did not directly deny it, instead saying: “This is pure speculation. As the speaker himself said today, he’s not going anywhere any time soon.” Ryan would be unlikely to publicize any planned departure because it could hurt his fundraising capacity on behalf of fellow Republicans and undercut his ability to make deals in the House of Representatives. A budget hawk who was Mitt Romney’s vice presidential running mate in 2012, Ryan reluctantly took over as speaker in 2015 following the resignation of John Boehner, who had held the post since early 2011 after Republicans won control of the chamber from Democrats. Boehner’s tenure as speaker was marked by fractious divisions among competing groups within the Republican Party. Ryan has tried to move the party beyond those disputes with only limited success.  Party divisions earlier this year prevented Republicans from delivering a promised overhaul of healthcare legislation, and the path toward tax reform has also been complicated by internal  disagreements and intense lobbying from industry groups. ",politicsNews,"December 14, 2017 "
Republican Representative Farenthold will not seek re-election,"AUSTIN, Texas/WASHINGTON (Reuters) - U.S. Republican Representative Blake Farenthold said he would not seek re-election in November, denying allegations of sexual harassment by former staffers but admitting he allowed an unprofessional culture to flourish in his Capitol Hill office. The 55-year-old congressman from Corpus Christi, Texas, made the announcement on Thursday, a week after the House Ethics Committee said it was investigating him over allegations of sexual harassment, discrimination and retaliation involving a former female staff member. The committee said it was also looking into whether Farenthold had made inappropriate statements to other members of his staff. In a videotaped statement on his campaign’s Facebook page, Farenthold said he was a political novice unprepared for his new responsibilities when he came to Washington for his first term in 2011. “I had no idea how to run a congressional office, and as a result, I allowed a workplace culture to take root in my office that was too permissive and decidedly unprofessional,” he said. Politico reported last week that the congressional Office of Compliance had paid $84,000 from a public fund on behalf of Farenthold for a sexual harassment claim. In 2014, his former communications director, Lauren Greene, filed a lawsuit accusing him of creating a hostile work environment, gender discrimination and retaliation, court documents showed. The two reached a confidential mediated agreement in 2015, according to a statement from Farenthold’s office that denied any wrongdoing by him. Reuters has been unable to verify the allegations against Farenthold, who said on Thursday that the charges were false.  “This issue has become a political distraction,” he said. “Quite simply, my constituents deserve better.” House of Representatives Speaker Paul Ryan called the allegations disconcerting, including reports outlining “unacceptable behaviors.”  “I think he’s made the right decision to retire,” Ryan said. Congress is reviewing its workplace policies on sexual harassment after a number of lawmakers have been accused of sexual misconduct in recent weeks amid a wave of such allegations against powerful men in entertainment, politics and the media.  Last week, Democratic Representative John Conyers and Republican Representative Trent Franks resigned, while Democratic Senator Al Franken said he would be stepping down in the coming weeks. ",politicsNews,"December 14, 2017 "
Alabama Senate race winner urges Republican rival to 'move on',"WASHINGTON (Reuters) - Alabama Democrat Doug Jones, who won a bitter fight for a U.S. Senate seat this week, on Thursday called on his Republican opponent to concede the race and help heal the Southern state after a deeply divisive contest. Roy Moore, the conservative Christian Republican whose campaign was tainted by accusations that he pursued teenaged girls while in his 30s, made a second statement on Wednesday night in which he did not concede the election. Jones, a former federal prosecutor, will be the first Democrat to hold a Senate seat in Alabama in a quarter-century, narrowing Republicans’ majority in the Senate to 51 of 100 seats and potentially making it more difficult for them to pursue President Donald Trump’s agenda. With 99 percent of the vote counted, Jones had a lead of 1.5 percentage points over Moore, a former Alabama Supreme Court Justice. Alabama’s secretary of state, a Republican, has said the remaining ballots from Tuesday’s election were unlikely to shrink the victory to the half a percentage point margin required to trigger a recount. Jones said in an interview with NBC that he was confident of the outcome. “It’s time to move on,” he said. “The people of Alabama have now spoken ... Let’s get this behind us so the people of Alabama can get someone in there and start working for them.” Asked whether Moore should concede, White House spokeswoman Sarah Sanders told reporters, “I’m surprised. It sounds like it ... should have already taken place.” Jones on Wednesday said he had received congratulatory phone calls from Trump, who had endorsed Moore, as well as Senate Republican leader Mitch McConnell and Senate Democratic leader Chuck Schumer. “The president’s already called and congratulated Doug Jones and expressed his willingness to work with him and meet with him when he arrives,” Sanders said. ",politicsNews,"December 14, 2017 "
